{
  "$schema": "./TYPORA_CAPABILITY_INVENTORY.schema.json",
  "schemaVersion": 2,
  "inventoryVersion": "1.2.0",
  "generatedAt": "2026-08-18T00:00:00+08:00",
  "sourceOfTruth": true,
  "inventoryStatus": "evidence_baseline",
  "benchmark": {
    "product": "Typora",
    "build": "1.14.6",
    "channel": "stable",
    "platform": {
      "os": "macOS 14 or later",
      "architecture": "arm64"
    },
    "releaseURL": "https://typora.io/releases/stable",
    "capturedDate": "2026-08-18"
  },
  "coverage": {
    "capabilityRefs": [
      {
        "requirementID": "INF-P0-FILE-001",
        "capabilityIDs": [
          "file.document-lifecycle"
        ]
      },
      {
        "requirementID": "INF-P0-MODE-001",
        "capabilityIDs": [
          "editing.source-mode"
        ]
      },
      {
        "requirementID": "INF-P0-MARKDOWN-001",
        "capabilityIDs": [
          "markdown.gfm-core"
        ]
      },
      {
        "requirementID": "INF-P0-THEME-001",
        "capabilityIDs": [
          "theme.builtin-appearance"
        ]
      },
      {
        "requirementID": "INF-P0-SETTINGS-001",
        "capabilityIDs": [
          "settings.editor-preferences"
        ]
      },
      {
        "requirementID": "INF-P0-EDIT-001",
        "capabilityIDs": [
          "editing.core-commands",
          "editing.search-replace",
          "writing.spell-language"
        ]
      },
      {
        "requirementID": "INF-P0-RECOVERY-001",
        "capabilityIDs": [
          "recovery.autosave-versioning"
        ]
      },
      {
        "requirementID": "INF-P0-NAV-001",
        "capabilityIDs": [
          "navigation.links-outline"
        ]
      },
      {
        "requirementID": "INF-P0-EXPORT-001",
        "capabilityIDs": [
          "export.native-single-document"
        ]
      },
      {
        "requirementID": "INF-P0-DIAGRAM-001",
        "capabilityIDs": [
          "diagram.mermaid",
          "math.inline-block"
        ]
      },
      {
        "requirementID": "INF-P1-MODE-001",
        "capabilityIDs": [
          "editing.instant-rendered"
        ]
      },
      {
        "requirementID": "INF-P1-WORKSPACE-001",
        "capabilityIDs": [
          "workspace.file-management"
        ]
      },
      {
        "requirementID": "INF-P1-EDIT-001",
        "capabilityIDs": [
          "editing.clickable-task-list",
          "editing.code-fence-tools",
          "editing.interactive-structures",
          "editing.smart-paste",
          "editing.syntax-highlighting"
        ]
      },
      {
        "requirementID": "INF-P1-MARKDOWN-001",
        "capabilityIDs": [
          "markdown.extended-writing"
        ]
      },
      {
        "requirementID": "INF-P1-RESOURCE-001",
        "capabilityIDs": [
          "resource.image-operations",
          "resource.image-workflow"
        ]
      },
      {
        "requirementID": "INF-P1-CONTENT-001",
        "capabilityIDs": [
          "content.scripted-network-html",
          "content.structured-html",
          "resource.remote-image-loading"
        ]
      },
      {
        "requirementID": "INF-P1-WRITING-001",
        "capabilityIDs": [
          "writing.focus-typewriter",
          "writing.statistics"
        ]
      },
      {
        "requirementID": "INF-P1-EXPORT-001",
        "capabilityIDs": [
          "export.print-long-image"
        ]
      },
      {
        "requirementID": "INF-P1-THEME-001",
        "capabilityIDs": [
          "theme.builtin-six"
        ]
      },
      {
        "requirementID": "INF-P2-EXPORT-001",
        "capabilityIDs": [
          "export.advanced-single-document"
        ]
      },
      {
        "requirementID": "INF-P2-DIALECT-001",
        "capabilityIDs": [
          "diagram.legacy-sequence-flow",
          "markdown.emoji",
          "markdown.highlight",
          "markdown.subscript",
          "markdown.superscript",
          "math.advanced-academic"
        ]
      },
      {
        "requirementID": "INF-P2-THEME-001",
        "capabilityIDs": [
          "theme.arbitrary-css"
        ]
      },
      {
        "requirementID": "INF-P2-PARITY-001",
        "capabilityIDs": [
          "export.pandoc-formats",
          "resource.image-upload"
        ]
      }
    ],
    "exclusions": [
      {
        "requirementID": "INF-P0-PLATFORM-001",
        "reason": "Sandboxing, distribution provenance, vulnerability gates, accessibility and resource budgets are Inflow release controls rather than a Typora user-capability benchmark.",
        "owner": "Release PM"
      },
      {
        "requirementID": "INF-P3-HEALTH-001",
        "reason": "The document health center is an Inflow differentiation target, not a Typora migration-parity claim.",
        "owner": "Quality PM"
      },
      {
        "requirementID": "INF-P3-PROFILE-001",
        "reason": "A shared semantic rendering profile across preview, diagnostics and export is an Inflow differentiation target, not a Typora migration-parity claim.",
        "owner": "Rendering PM"
      },
      {
        "requirementID": "INF-P3-HISTORY-001",
        "reason": "Inflow's Recovery-isolated local version timeline is a differentiated lifecycle contract and is not claimed as direct Typora parity.",
        "owner": "Reliability PM"
      },
      {
        "requirementID": "INF-P3-MERGE-001",
        "reason": "Interactive block-level three-way merge is an Inflow differentiation target, not a Typora migration-parity claim.",
        "owner": "Collaboration PM"
      },
      {
        "requirementID": "INF-P3-RESOURCE-001",
        "reason": "Resource governance and previewed structural batch edits are Inflow differentiation targets, not Typora migration-parity claims.",
        "owner": "Resource PM"
      }
    ]
  },
  "evidenceRegistry": {
    "corpora": [],
    "operationSamples": []
  },
  "capabilities": [
    {
      "capabilityID": "file.document-lifecycle",
      "requirementID": "INF-P0-FILE-001",
      "category": "file",
      "typoraPlatform": {
        "os": "macOS 14 or later",
        "architecture": "arm64"
      },
      "typoraBuild": "1.14.6",
      "settingsProfile": "typora-1.14.6-macos-default-file-management",
      "officialEvidenceURL": "https://support.typora.io/File-Management/",
      "evidenceDate": "2026-08-18",
      "expectedBehavior": "Users can create, open, save, rename, move and manage Markdown documents through the native file and sidebar workflows.",
      "inflowPath": "P0 native document lifecycle with conflict-safe open, save, Save As and external-change handling.",
      "owner": "Document PM",
      "status": "evidence_captured",
      "corpusIDs": [],
      "operationSampleIDs": [],
      "exceptionID": null
    },
    {
      "capabilityID": "editing.source-mode",
      "requirementID": "INF-P0-MODE-001",
      "category": "editing",
      "typoraPlatform": {
        "os": "macOS 14 or later",
        "architecture": "arm64"
      },
      "typoraBuild": "1.14.6",
      "settingsProfile": "typora-1.14.6-macos-default-writing",
      "officialEvidenceURL": "https://support.typora.io/Shortcut-Keys/",
      "evidenceDate": "2026-08-18",
      "expectedBehavior": "The View menu exposes a keyboard-accessible source-code mode in addition to Typora's live rendered editing surface.",
      "inflowPath": "P0 exposes explicit source editing, split live preview and preview-only modes with stable shortcuts and first-window defaults.",
      "owner": "Editor PM",
      "status": "evidence_captured",
      "corpusIDs": [],
      "operationSampleIDs": [],
      "exceptionID": null
    },
    {
      "capabilityID": "theme.builtin-appearance",
      "requirementID": "INF-P0-THEME-001",
      "category": "theme",
      "typoraPlatform": {
        "os": "macOS 14 or later",
        "architecture": "arm64"
      },
      "typoraBuild": "1.14.6",
      "settingsProfile": "typora-1.14.6-macos-builtin-themes",
      "officialEvidenceURL": "https://support.typora.io/About-Themes/",
      "evidenceDate": "2026-08-18",
      "expectedBehavior": "Built-in themes are selectable from the Themes menu and macOS can use separate light- and dark-mode choices.",
      "inflowPath": "P0 ships deterministic light and dark built-in preview themes with a follow-system choice.",
      "owner": "Theme PM",
      "status": "evidence_captured",
      "corpusIDs": [],
      "operationSampleIDs": [],
      "exceptionID": null
    },
    {
      "capabilityID": "settings.editor-preferences",
      "requirementID": "INF-P0-SETTINGS-001",
      "category": "settings",
      "typoraPlatform": {
        "os": "macOS 14 or later",
        "architecture": "arm64"
      },
      "typoraBuild": "1.14.6",
      "settingsProfile": "typora-1.14.6-macos-default-preferences",
      "officialEvidenceURL": "https://support.typora.io/Quick-Start/",
      "evidenceDate": "2026-08-18",
      "expectedBehavior": "Discoverable preferences control recurring editor behaviors such as word-count visibility and appearance choices.",
      "inflowPath": "P0 provides a typed Settings contract for mode defaults, font size, editor aids, navigation and file-opening behavior.",
      "owner": "Settings PM",
      "status": "evidence_captured",
      "corpusIDs": [],
      "operationSampleIDs": [],
      "exceptionID": null
    },
    {
      "capabilityID": "editing.core-commands",
      "requirementID": "INF-P0-EDIT-001",
      "category": "editing",
      "typoraPlatform": {
        "os": "macOS 14 or later",
        "architecture": "arm64"
      },
      "typoraBuild": "1.14.6",
      "settingsProfile": "typora-1.14.6-macos-default-keymap",
      "officialEvidenceURL": "https://support.typora.io/Shortcut-Keys/",
      "evidenceDate": "2026-08-18",
      "expectedBehavior": "Keyboard-accessible commands insert or transform headings, lists, tables, code, math, links and inline formatting while standard edit operations remain available.",